{"$schema":"https://json-schema.org/draft/2020-12/schema","$id":"urn:linggan:comment-study:start-run:v2","$comment":"Generated documentation companion. Rust additionally enforces UTF-8 bytes, scope membership, <=100 distinct works, source eligibility, locks and budgets. Not deployed.","title":"StartStudyRun HTTP command","type":"object","additionalProperties":false,"required":["requestRef","domainRef","policyRef","scope","mode","limits","reason"],"properties":{"requestRef":{"type":"string","format":"uuid"},"domainRef":{"type":"string","format":"uuid","const":"00000000-0000-4000-8000-000000000001"},"policyRef":{"type":"string","format":"uuid"},"scope":{"oneOf":[{"type":"object","additionalProperties":false,"required":["kind","workRefs"],"properties":{"kind":{"const":"works"},"workRefs":{"type":"array","minItems":1,"maxItems":100,"items":{"type":"string","format":"uuid"}}}},{"type":"object","additionalProperties":false,"required":["kind","commentKeys"],"properties":{"kind":{"const":"comments"},"commentKeys":{"type":"array","minItems":1,"maxItems":3000,"items":{"type":"object","additionalProperties":false,"required":["workRef","commentExternalId"],"properties":{"workRef":{"type":"string","format":"uuid"},"commentExternalId":{"type":"string","minLength":1,"maxLength":512,"x-maxUtf8Bytes":512}}},"x-distinctWorkRefMax":100}}}]},"mode":{"enum":["new_only","input_changed","retry_failed","reanalyse"]},"limits":{"type":"object","additionalProperties":false,"required":["commentBudget","tokenLimit"],"properties":{"commentBudget":{"type":"integer","minimum":1,"maximum":3000},"tokenLimit":{"type":"integer","minimum":1024,"maximum":10000000}}},"reason":{"type":["string","null"],"maxLength":500}},"allOf":[{"if":{"properties":{"mode":{"const":"new_only"}}},"then":{"properties":{"reason":{"type":"null"}}},"else":{"properties":{"reason":{"type":"string","minLength":1,"maxLength":500,"pattern":"\\S"}}}}]}
